{
  "person": {
    "real_professional_name": { "value": "Jane Doe", "source_ids": ["PERSON_PROFILE_NAME"] },
    "current_role": { "value": "VP Sales", "source_ids": ["PERSON_PROFILE_ROLE"] },
    "professional_experience": { "value": null, "source_ids": [] },
    "current_company": { "value": "Acme Analytics", "source_ids": ["PERSON_PROFILE_COMPANY"] },
    "verified_responsibilities": [
      { "value": "Lead the EMEA enterprise sales team", "source_ids": ["PERSON_PROFILE_RESPONSIBILITY_1"] }
    ],
    "verified_professional_interests": [
      { "value": "sales pipeline", "source_ids": ["PERSON_POST_1", "PERSON_POST_2"] }
    ],
    "observed_prospect_facts": [
      { "value": "Discusses enterprise sales forecasting", "source_ids": ["PERSON_POST_1"] }
    ]
  },
  "company": {
    "official_website": { "value": "https://acme-analytics.example", "status": "confirmed", "source_ids": ["COMPANY_WEBSITE_1"] },
    "company_context": [
      { "value": "Acme Analytics provides analytics software for enterprises", "source_ids": ["COMPANY_WEBSITE_FACT_1"] }
    ],
    "verified_company_priorities": [
      { "value": "We are investing in real-time analytics", "source_ids": ["COMPANY_WEBSITE_FACT_2"] }
    ],
    "observed_company_facts": []
  },
  "outreach": {
    "suggested_message": "Hello Jane, I noticed your work as VP Sales at Acme Analytics and your recent comments about the sales pipeline. Would a brief exchange be useful?",
    "source_ids": ["PERSON_POST_1"]
  },
  "limitations": [],
  "confidence_inputs": {
    "has_name": true,
    "has_role": true,
    "has_company": true,
    "has_confirmed_website": true,
    "has_person_posts": true,
    "has_company_evidence": true
  }
}
